question_id,local-or-sum,cor_section,attribute1,attribute2,question,ex-or-im1,answer1,answer2,answer3,ex-or-im2,answer4,answer5,answer6
1,local,1,character,,What type of person was the woman's son?,explicit,lazy and slow,,,,,,
2,local,1,outcome resolution,,What happened because the son was so lazy and slow?,explicit,There was not a single blessed useful thing he would do.,,,,,,
3,local,1,feeling,,How did the woman feel about her son singing and dancing?,implicit,unhappy,discontent,upset,,,,
4,local,1,outcome resolution,,What happened to the son's clothes when he skipped and danced?,implicit,ripped,dirtied,fell apart,,,,
5,local,1,causal relationship,,Why did the son want to marry the daughter of the mother in the corner?,explicit,"He would live happily ever after, and could sing and dance, and would not have to plague himself with work.",,,,,,
6,local,2,causal relationship,,Why did the mother dress the youth as well as she could?,explicit,He would make a good showing when he came to the mother in the corner.,,,,,,
7,summary,"1,2",causal relationship,,Why did the mother think the youth's idea was not a bad idea?,implicit,She could not afford to care for him anymore.,She wanted him to do something with his life.,She could not stand his laziness anymore.,,,,
8,local,2,action,,What did the youth do as he made his way to the mother in the corner?,explicit,sang and danced,,,,,,
9,local,2,outcome resolution,,What happened when the youth set foot on the clump of grass?,explicit,"He went down and down until he was standing in a dark, ugly hole.",,,,,,
10,local,2,action,,What was the rat doing when the youth saw her?,explicit,wiggling and waggling around and had a bunch of keys hanging from her tail,,,,,,
11,local,3,action,,What did the rat think the youth was doing there?,explicit,to win her,,,,,,
12,local,3,causal relationship,,Why did the rat ask the youth to be patient?,explicit,She was to receive a larger dower and was not yet ready for the wedding.,,,,,,
13,local,3,action,,What did the rat tell the youth to do while he waited?,explicit,sit down and help himself,,,,,,
14,local,3,prediction,feeling,How will the youth feel about the food provided by the rat?,implicit,unsure,dislike,hesitant,,,,
15,summary,"3,4",causal relationship,,Why did the youth have no great appetite for the food?,implicit,It was rat food.,The food was gross.,The food was not for humans.,,,,
16,local,4,causal relationship,,Why did the rat give the youth the linen thread?,implicit,so he could go home,so he could return home and come back again later,,,,,
17,local,4,feeling,,How did the youth feel when the rat allowed him to go above?,implicit,excited,happy,relieved,,,,
18,local,4,action,,What did the rat tell the youth to repeat?,explicit,Short before and long behind',,,,,,
19,local,4,causal relationship,,Why was the youth in no hurry to go down the hole again?,implicit,He did not like being down there.,He did not want to be in the hole.,,,,,
20,local,5,feeling,,How did the mother feel when she saw the linen?,implicit,disbelief,surprised,shocked,,,,
21,local,5,causal relationship,,Why was the mother so pleased with the linen?,implicit,She could use it to make clothes.,She could sell it for money.,,,,,
22,local,5,outcome resolution,,What happened after the woman had not a bite to eat in the house?,explicit,She told her son that it was the highest time of him to take service.,,,,,,
23,local,5,causal relationship,,Why were the mother and son able to live in joy and comfort?,implicit,They had plenty of clothes to wear.,They earned money from selling the linen.,,,,,
24,summary,"1,5",prediction,action,What will the youth want to do instead of taking service?,explicit,go to the mother in the corner,,,,,,
25,local,6,causal relationship,,Why did the mother think it would be a good idea for the youth to go to the mother in the corner?,explicit,The youth was handsomely dressed and made a good showing.,,,,,,
26,local,6,action,,What was sun doing when the youth stepped out?,explicit,shining bright and warm,,,,,,
27,local,6,action,,What did the youth come to as he was hopping and skipping along?,explicit,the log across the swamp,,,,,,
28,local,6,action,,What did the youth need to do to not dirty his shoes?,explicit,jump over a puddle to a clump of grass,,,,,,
29,local,7,setting,,When would all be ready according to the rat?,explicit,by the time the youth came again,,,,,,
30,local,7,causal relationship,,Why did the youth not want to eat the food?,explicit,It looked like food that had been eaten.,He had no appetite.,,,,,
31,local,7,action,,What did the rat give the youth to return home?,explicit,woolen thread,,,,,,
32,summary,"4,5,7",prediction,action,What will the youth find when he returns home?,implicit,piles of wool,lots of woolen goods,yards of wool,,,,
33,summary,"5,8",prediction,action,What will the youth and his mother do with the wool?,implicit,make clothes,sell it,,,,,
34,local,8,feeling,,How did the youth feel to escape?,explicit,happy,satisfied,relieved,,,,
35,local,9,action,,What did the mother do when she came to the door?,explicit,"clasped her hands together over her head, and nearly fainted with joy.",,,,,,
36,local,9,outcome resolution,,What was brought to the mother and son because of the wool?,explicit,a small fortune,,,,,,
37,local,9,action,,What did the mother do with her small fortune?,explicit,decorated her room,,,,,,
38,local,9,outcome resolution,action,What did the mother say would happen if the son did not look for work?,explicit,Both of them would starve to death.,,,,,,
39,local,10,causal relationship,,Why did the mother think her son would not be refused?,explicit,He was such a good-looking fellow.,,,,,,
40,local,10,action,,What did the youth do differently after setting forth this time compared to the previous times?,explicit,"took a roundabout way, the longest he could fine",,,,,,
41,local,10,causal relationship,,Why did the youth choose the longest way?,explicit,He did not want to go down to the rat again because he was sick of her eternal wiggling and waggling and the talk about marriage.,,,,,,
42,local,10,feeling,,How did the youth feel to see the rat again?,implicit,upset,disgusted,repulsed,,,,
43,summary,"7,10",prediction,action,What will happen now that the youth has returned again?,implicit,the wedding,The rat and the youth will marry.,,,,,
44,local,11,outcome resolution,,What happened after the rat whistled?,explicit,"Every corner was alive with swarms of mice and small rats, and six large rats came dragging along a frying-pan.",,,,,,
45,local,11,causal relationship,,Why did the youth need to walk beside the coach?,explicit,The road was a little narrow there.,,,,,,
46,local,11,action,,What did the youth plan to do once they were safely above?,explicit,run away from the whole pack of them,,,,,,
47,local,11,character,,Who sprang up in front to drive the coach?,explicit,two rats,,,,,,
48,local,11,action,,What did the youth hear once after walking in advance?,explicit,"a clear, beautiful voice",,,,,,
49,local,12,feeling,,How did the youth feel when he saw the maiden?,explicit,astonished,,,,,,
50,local,12,causal relationship,,What made the princess and her playmates turn to rats?,explicit,They had all been enchanted together.,,,,,,
51,local,12,action,,How were the princess and her playmates delivered?,explicit,The youth had come down to them and never contradicted.,,,,,,
52,summary,"11,12",character,action,What had the six large rats turned into?,explicit,six white horses,,,,,,
53,local,12,character,,What did the maiden look like?,explicit,fair and beautiful as the sun,,,,,,
54,local,13,setting,,Where did the youth think the princess had lived?,explicit,a hideous rat-hole,,,,,,
55,local,13,setting,,Where did the princess actually live?,explicit,a beautiful castle,,,,,,
56,local,13,setting,,When did the wedding festivities begin?,explicit,when the youth's mother came,,,,,,
57,local,13,feeling,,How did the youth feel when he saw the beautiful castle?,implicit,shocked,awed,amazed,,,,
