document_id,text
youth-who-was-to-serve-three-years-without-pay,"Once upon a time there was a poor man, who had only one son; but one who was so lazy and clumsy that he did not want to do a stroke of work."
youth-who-was-to-serve-three-years-without-pay,"""If I am not to feed this bean-pole for the rest of my life, I'll have to send him far away, where not a soul knows him,"" thought the father."
youth-who-was-to-serve-three-years-without-pay,"""Once he is knocking about in the world, he will not be so likely to come home again."""
youth-who-was-to-serve-three-years-without-pay,"So he took his son and led him about in the world, far and wide, and tried to get him taken on as a serving man; but no one would have him."
youth-who-was-to-serve-three-years-without-pay,"Finally, after wandering a long time, they came to a rich man, of whom it was said that he turned every shilling around seven times before he could make up his mind to part with it."
youth-who-was-to-serve-three-years-without-pay,"He was willing to take the youth for a servant, and he was to work three years without pay."
youth-who-was-to-serve-three-years-without-pay,"But at the end of the three years, his master was to go into town, two days in succession, and buy the first thing he saw, and on the third morning the youth himself was to go to town and also buy the first thing he met."
youth-who-was-to-serve-three-years-without-pay,And all this he was to receive in lieu of his wage.
youth-who-was-to-serve-three-years-without-pay,"So the youth served out his three years, and did better than they had expected him to do."
youth-who-was-to-serve-three-years-without-pay,"He was by no means a model serving-man; but then his master was none of the best, either, for he let him go all that time in the same clothes he had worn when he entered his service, until, finally, one patch elbowed the other."
youth-who-was-to-serve-three-years-without-pay,"Now when his master was to go to do his buying, he set out as early as possible in the morning."
youth-who-was-to-serve-three-years-without-pay,"""Costly wares are only to be seen by day,"" said he, ""they are not drifting about the street so early. It will probably cost me enough as it is, for what I find is a matter of purest chance."""
youth-who-was-to-serve-three-years-without-pay,"The first thing he saw on the street was an old woman, who was carrying a covered basket."
youth-who-was-to-serve-three-years-without-pay,"""Good-day, granny,"" said the man."
youth-who-was-to-serve-three-years-without-pay,"""And good-day to you, daddy,"" said the old woman."
youth-who-was-to-serve-three-years-without-pay,"""What have you in your basket?"" asked the man."
youth-who-was-to-serve-three-years-without-pay,"""Would you like to know?"" said the woman."
youth-who-was-to-serve-three-years-without-pay,"""Yes,"" said the man, ""for I have to buy the first thing that comes my way."""
youth-who-was-to-serve-three-years-without-pay,"""Well, if you want to know, buy it!"""
youth-who-was-to-serve-three-years-without-pay,said the old woman.
youth-who-was-to-serve-three-years-without-pay,"""What does it cost?"" asked the man."
youth-who-was-to-serve-three-years-without-pay,"She must have four shillings for it, declared the woman."
youth-who-was-to-serve-three-years-without-pay,"This did not seem such a tremendous price to him, he would let it go at that, said he, and raised the cover."
youth-who-was-to-serve-three-years-without-pay,And there lay a pup in the basket.
youth-who-was-to-serve-three-years-without-pay,"When the man got home from his journey to town, there stood the youth full of impatience and curiosity, wondering what his wage for the first year might be."
youth-who-was-to-serve-three-years-without-pay,"""Are you back already, master?"" asked the youth."
youth-who-was-to-serve-three-years-without-pay,"""Yes, indeed,"" said his master."
youth-who-was-to-serve-three-years-without-pay,"""And what have you bought?"""
youth-who-was-to-serve-three-years-without-pay,asked the youth.
youth-who-was-to-serve-three-years-without-pay,"""What I have bought is nothing so very rare,"" said the man."
youth-who-was-to-serve-three-years-without-pay,"""I don't even know whether I ought to show it to you; but I bought the first thing to be had, and that was a pup,"" said he."
youth-who-was-to-serve-three-years-without-pay,"""And I thank you most kindly for it,"" said the youth."
youth-who-was-to-serve-three-years-without-pay,"""I have always been fond of dogs."""
youth-who-was-to-serve-three-years-without-pay,The following morning it was no better.
youth-who-was-to-serve-three-years-without-pay,"The man set out as early as possible, and had not as yet reached town before he met the old woman with the basket."
youth-who-was-to-serve-three-years-without-pay,"""Good-day, granny,"" said the man."
youth-who-was-to-serve-three-years-without-pay,"""And good-day to you, daddy,"" said the old woman."
youth-who-was-to-serve-three-years-without-pay,"""What have you in your basket to-day?"" asked the man."
youth-who-was-to-serve-three-years-without-pay,"""If you want to know, then buy it!"" was again the answer."
youth-who-was-to-serve-three-years-without-pay,"""What does it cost?"" asked the man."
youth-who-was-to-serve-three-years-without-pay,"She wanted four shillings for it, she had only the one price."
youth-who-was-to-serve-three-years-without-pay,"The man said he would buy it, for he thought that this time he would make a better purchase."
youth-who-was-to-serve-three-years-without-pay,"He raised the cover, and this time a kitten lay in the basket."
youth-who-was-to-serve-three-years-without-pay,"When he reached home, there stood the youth, waiting to see what he was to get in lieu of his second year's wages."
youth-who-was-to-serve-three-years-without-pay,"""Are you back again, master!"" said he."
youth-who-was-to-serve-three-years-without-pay,"""Yes, indeed,"" said the master."
youth-who-was-to-serve-three-years-without-pay,"""What did you buy to-day?"" asked the youth."
youth-who-was-to-serve-three-years-without-pay,"""Alas, nothing better than I did yesterday,"" said the man, ""but I did as we agreed, and bought the first thing I came across, and that was this kitten."""
youth-who-was-to-serve-three-years-without-pay,"""You could not have hit on anything better,"" said the youth, ""for all my life long I have been fond of cats as well as of dogs."""
youth-who-was-to-serve-three-years-without-pay,"""I do not fare so badly this way,"" thought the man, ""but when he sets out for himself, then the matter will probably turn out differently."""
youth-who-was-to-serve-three-years-without-pay,"So the third morning the youth set out for himself, and when he entered town, he came across the same old woman with her basket on her arm."
youth-who-was-to-serve-three-years-without-pay,"""Good morning, granny,"" said he."
youth-who-was-to-serve-three-years-without-pay,"""And good morning to you, my boy,"" said the old woman."
youth-who-was-to-serve-three-years-without-pay,"""What have you in your basket?"" asked the youth."
youth-who-was-to-serve-three-years-without-pay,"""If you want to know, then buy it!"""
youth-who-was-to-serve-three-years-without-pay,answered the old woman.
youth-who-was-to-serve-three-years-without-pay,"""Do you want to sell it?"" asked the youth."
youth-who-was-to-serve-three-years-without-pay,"Yes, indeed, and it would cost four shillings, said the old woman."
youth-who-was-to-serve-three-years-without-pay,"That is a bargain, thought the youth, and wanted to take it, for he had to buy the first thing that came his way."
youth-who-was-to-serve-three-years-without-pay,"""Well, you can take the whole blessed lot,"" said the old woman, ""the basket and all that's in it. But do not look into it before you get home, do you hear!"""
youth-who-was-to-serve-three-years-without-pay,"No, indeed, he would be sure not to look in the basket, said he."
youth-who-was-to-serve-three-years-without-pay,"But on the way, he kept wondering as to what might be in the basket, and willy-nilly--he could not keep from raising the cover a little, and looking through the crack."
youth-who-was-to-serve-three-years-without-pay,"But that very minute a little lizard popped out of the crack, and ran across the road so quickly that it fairly hummed--and aside from the lizard there was nothing in the basket."
youth-who-was-to-serve-three-years-without-pay,"""Stop, wait a minute, and don't run away! I just bought you,"" said the youth."
youth-who-was-to-serve-three-years-without-pay,"""Stab me in the neck! Stab me in the neck!"""
youth-who-was-to-serve-three-years-without-pay,cried the lizard.
youth-who-was-to-serve-three-years-without-pay,The youth did not have to be told twice.
youth-who-was-to-serve-three-years-without-pay,He ran after the lizard and stabbed it in the neck just as it was slipping into a hole in a wall.
youth-who-was-to-serve-three-years-without-pay,"And that very moment it turned into a man, as handsome and splendid as the handsomest prince, and a prince he was, if truth be told."
youth-who-was-to-serve-three-years-without-pay,"""Now you have delivered me,"" said he, ""for the old woman, with whom you and your master have been dealing, is a witch, and she turned me into a lizard, and my brother and sister into a dog and cat."""
youth-who-was-to-serve-three-years-without-pay,The youth thought this a remarkable tale.
youth-who-was-to-serve-three-years-without-pay,"""Yes, indeed,"" said the prince."
youth-who-was-to-serve-three-years-without-pay,"""She was actually on the way to throw us into the sea and drown us; but if any one were to appear and want to buy us, she had to sell us for four shillings apiece, that had been agreed upon. And now you shall go home with me to my father, and be rewarded for your good deed."""
youth-who-was-to-serve-three-years-without-pay,"""Your home must be a good way off,"" said the youth."
youth-who-was-to-serve-three-years-without-pay,"""O, it is not so far,"" declared the prince, ""there it is!"""
youth-who-was-to-serve-three-years-without-pay,And he pointed to a high hill in the distance.
youth-who-was-to-serve-three-years-without-pay,"They marched along as fast as they could, but still it was farther away than it seemed."
youth-who-was-to-serve-three-years-without-pay,So it was late at night before they reached their goal.
youth-who-was-to-serve-three-years-without-pay,The prince knocked.
youth-who-was-to-serve-three-years-without-pay,"""Who is knocking at my door, and disturbing my sleep?"" came a voice within the hill."
youth-who-was-to-serve-three-years-without-pay,And the voice was so powerful that the earth trembled.
youth-who-was-to-serve-three-years-without-pay,"""Open, father, your son has come home!"""
youth-who-was-to-serve-three-years-without-pay,cried the prince.
youth-who-was-to-serve-three-years-without-pay,Then the father was glad to open the door quickly.
youth-who-was-to-serve-three-years-without-pay,"""I thought you were already lying at the bottom of the sea,"" said the old man."
youth-who-was-to-serve-three-years-without-pay,"""But you are not alone?"""
youth-who-was-to-serve-three-years-without-pay,"""This is the chap who delivered me,"" said the prince, ""and I asked him to come with me so that you could reward him."""
youth-who-was-to-serve-three-years-without-pay,"That he would attend to, said the old man."
youth-who-was-to-serve-three-years-without-pay,"""Now you must come right in,"" said he, ""for here you may rest in safety."""
youth-who-was-to-serve-three-years-without-pay,"They went in and sat down, and the old man laid an armful of wood and a couple of big logs on the fire, until every corner was as bright as day, and wherever they looked everything was indescribably splendid."
youth-who-was-to-serve-three-years-without-pay,"The youth had never seen anything like it, and such fine things to eat and drink as the old man served up to him, he had never yet tasted."
youth-who-was-to-serve-three-years-without-pay,"And the bowls and dishes, and goblets and plates, were all of pure silver and shining gold."
youth-who-was-to-serve-three-years-without-pay,There was no need to urge the young folk.
youth-who-was-to-serve-three-years-without-pay,"They ate and drank and enjoyed themselves, and then slept far into the next day."
youth-who-was-to-serve-three-years-without-pay,The youth was still asleep when the old man came and offered him a morning draft in a golden goblet.
youth-who-was-to-serve-three-years-without-pay,"And when he had put on his rags and breakfasted, he was allowed to pick out what he wanted, as a reward for delivering the prince."
youth-who-was-to-serve-three-years-without-pay,"There was much to see and still more to take, as you may believe."
youth-who-was-to-serve-three-years-without-pay,"""Well, what do you want?"" asked the king."
youth-who-was-to-serve-three-years-without-pay,"""You may take what you will; for as you see there is enough from which to choose."""
youth-who-was-to-serve-three-years-without-pay,"The youth said he would have to think it over a bit, and speak to the prince."
youth-who-was-to-serve-three-years-without-pay,And that he was allowed to do.
youth-who-was-to-serve-three-years-without-pay,"""Well, I suppose you have seen all sorts of beautiful things?"" asked the prince."
youth-who-was-to-serve-three-years-without-pay,"""That is a fact,"" said the youth."
youth-who-was-to-serve-three-years-without-pay,"""But tell me, what ought I to choose among all these magnificent things? Your father said I might pick out whatever I wished."""
youth-who-was-to-serve-three-years-without-pay,"""You must choose none among all the things you have seen,"" answered the prince, ""but my father wears a ring on his little finger, and you must ask him for that."""
youth-who-was-to-serve-three-years-without-pay,"This the youth did, and begged the king for the ring on his finger."
youth-who-was-to-serve-three-years-without-pay,"""It is dearer to me than anything else I have,"" said the king, ""but my son is just as dear to me, and therefore I will give you the ring. Do you know what powers it has?"""
youth-who-was-to-serve-three-years-without-pay,"No, that the youth did not know."
youth-who-was-to-serve-three-years-without-pay,"""While you wear it on your finger, you can get everything that you want to have,"" said the king."
youth-who-was-to-serve-three-years-without-pay,"The youth thanked him most kindly, and the king and the prince wished him all manner of luck on his journey, and charged him to take the best care of the ring."
youth-who-was-to-serve-three-years-without-pay,He had not been long underway before it occurred to him to test what the ring could do.
youth-who-was-to-serve-three-years-without-pay,"So he wished to be dressed in new clothes from head to toe, and no more had he uttered the wish than there he was in them."
youth-who-was-to-serve-three-years-without-pay,And he looked as handsome and bright as a new nickel.
youth-who-was-to-serve-three-years-without-pay,Then he thought to himself it would be pleasant to play a trick on his father.
youth-who-was-to-serve-three-years-without-pay,"""He was none too friendly to me while I was still at home."""
youth-who-was-to-serve-three-years-without-pay,"And so the youth wished he were standing before his father's door, just as ragged as he had been before."
youth-who-was-to-serve-three-years-without-pay,And that very minute there he stood.
youth-who-was-to-serve-three-years-without-pay,"""Good-day, father, and many thanks for the last time!"" said the youth."
youth-who-was-to-serve-three-years-without-pay,"But when his father saw he had come home far more tattered and torn than when he had gone away, he grew angry and began to scold: ""There is nothing to be made of you, if during all the long years of your service you have not even been able to earn a suit of clothes to your back."""
youth-who-was-to-serve-three-years-without-pay,"""Now do not be so angry, father,"" said the youth."
youth-who-was-to-serve-three-years-without-pay,"""You need not take for granted that a fellow is a vagabond because he goes about in rags. Now I want you to go to the king as my proxy, and ask his daughter's hand for me."""
youth-who-was-to-serve-three-years-without-pay,"""Come, come, why, that is utter folly and nonsense!"""
youth-who-was-to-serve-three-years-without-pay,cried his father.
youth-who-was-to-serve-three-years-without-pay,"But the youth insisted that it was gospel truth, and took a birch bough, and drove his father to the king's castle-gate."
youth-who-was-to-serve-three-years-without-pay,"And the latter came stumbling right in to the king, and wept so that the tears just tumbled out."
youth-who-was-to-serve-three-years-without-pay,"""Well, what has happened to you, my dear fellow?"" asked the king."
youth-who-was-to-serve-three-years-without-pay,"""If a wrong has been done you, I will see that you get your rights."""
youth-who-was-to-serve-three-years-without-pay,"No, no wrong had been done him, said the man, but he had a son who gave him a great deal of trouble: it was impossible to make a man of him, and now he had evidently lost what few senses he did possess."
youth-who-was-to-serve-three-years-without-pay,"""Because he has just chased me to the castle-gate with a birch bough, and threatened me, if I do not get him the king's daughter for a bride,"" said the man."
youth-who-was-to-serve-three-years-without-pay,"""Set your mind at rest, my good fellow,"" said the king, ""and send your son to me. Then we will see whether we can come to an understanding."""
youth-who-was-to-serve-three-years-without-pay,"The youth came rushing in to the king, so that his rags fairly fluttered."
youth-who-was-to-serve-three-years-without-pay,"""Do I get your daughter?"" he cried."
youth-who-was-to-serve-three-years-without-pay,"""Well, that is just what we are going to discuss,"" said the king, ""perhaps she would not answer for you, and perhaps you would not answer for her,"" said he."
youth-who-was-to-serve-three-years-without-pay,"That might be the case, said the youth."
youth-who-was-to-serve-three-years-without-pay,"Now a great ship from abroad had shortly before come into port, and one could see it from the castle window."
youth-who-was-to-serve-three-years-without-pay,"""Now we'll see,"" said the king."
youth-who-was-to-serve-three-years-without-pay,"""If you can build a ship that is the exact counterpart of the one outside, and just as handsome, in the space of an hour or two, then, perhaps, you may get my daughter,"" said the king."
youth-who-was-to-serve-three-years-without-pay,"""If it be no more than that ..."" said the youth."
youth-who-was-to-serve-three-years-without-pay,"Then he went down to the shore and sat on a sand-pile, and when he had sat there long enough, he wished that a ship might lie out in the fjord, completely equipped with masts and sails and all that goes with them, and that it might resemble the ship already lying there in every particular."
youth-who-was-to-serve-three-years-without-pay,"And that very minute there lay the ship, and when the king saw that there were two ships at anchor instead of one, he came down to the shore himself to look more closely into the matter."
youth-who-was-to-serve-three-years-without-pay,And then he saw the youth.
youth-who-was-to-serve-three-years-without-pay,"He was standing in a boat, with a broom in one hand, as though he meant to give the ship a final cleaning; but when he saw the king coming, he threw away the broom and cried: ""Now the ship is finished. Do I get your daughter now?"""
youth-who-was-to-serve-three-years-without-pay,"""That is all very fine,"" said the king, ""but you must stand yet another test. If you can build a castle that is just like mine in every particular within an hour or so, then we will go further into the matter."""
youth-who-was-to-serve-three-years-without-pay,"""No more than that?"" cried the youth."
youth-who-was-to-serve-three-years-without-pay,"After he had strolled around for a long while, and the time set was nearly over, he wished that a castle might stand there that resembled the king's castle in every particular."
youth-who-was-to-serve-three-years-without-pay,"And before long there it stood, as you may believe."
youth-who-was-to-serve-three-years-without-pay,"And it did not take long, either, before the king, together with the queen and the princess, came to look at the new castle."
youth-who-was-to-serve-three-years-without-pay,"The youth stood there with his broom again, and swept and cleaned."
youth-who-was-to-serve-three-years-without-pay,"""Now the castle is in apple-pie order. Do I get her now?"""
youth-who-was-to-serve-three-years-without-pay,he cried.
youth-who-was-to-serve-three-years-without-pay,"""That's all very fine,"" declared the king, ""just come in and we'll talk it over,"" said he, for he had noticed that the youth knew a thing or two, and he was thinking over how he might get rid of him."
youth-who-was-to-serve-three-years-without-pay,"The king went on ahead, and after him the queen, and then went the princess, just in advance of the youth."
youth-who-was-to-serve-three-years-without-pay,"Then he at once wished to be the handsomest man in the world, and so he was, that very minute."
youth-who-was-to-serve-three-years-without-pay,"When the princess saw what a splendid figure he suddenly cut, she nudged the queen, who in turn nudged the king, and after they had stared at him long enough, they at last realized that the youth was more than he had at first appeared to be, in his rags."
youth-who-was-to-serve-three-years-without-pay,"So they decided that the princess was to treat him nicely, in order to find out how matters really stood, and the princess was as sweet and amiable as sugar-bread, and flattered the youth, and said that she could not do without him, night or day."
youth-who-was-to-serve-three-years-without-pay,"And when it came toward the end of the first evening, she said: ""Since you and I are to be married in any case, I am sure you will have no secrets from me, and you will not want to hide from me how you managed to do all these fine things."""
youth-who-was-to-serve-three-years-without-pay,"""O, yes,"" said the youth."
youth-who-was-to-serve-three-years-without-pay,"""You shall know about it, but first of all let us be married; before that nothing counts!"""
youth-who-was-to-serve-three-years-without-pay,The following evening the princess pretended to be quite unhappy.
youth-who-was-to-serve-three-years-without-pay,"She was well aware, said she, that he did not attach much importance to her love, when he would not even tell her what she wanted so much to know."
youth-who-was-to-serve-three-years-without-pay,"If he could not even oblige her in such a small matter, his love could not amount to a great deal."
youth-who-was-to-serve-three-years-without-pay,"Then the youth fell into despair, and to make up with her again, he told her everything."
youth-who-was-to-serve-three-years-without-pay,"She lost no time, and let the king and queen know all about it."
youth-who-was-to-serve-three-years-without-pay,"Thereupon they agreed as to how they would go about getting the youth's ring away from him, and then, thought they, it would not really be hard to get rid of him."
youth-who-was-to-serve-three-years-without-pay,"In the evening the princess came with a sleeping potion, and said she wanted to give her lover a drink that would increase his love for her, since it was plain he did not love her enough."
youth-who-was-to-serve-three-years-without-pay,"The youth suspected nothing, and drank, and at once fell so fast asleep that they could have pulled down the house over his head."
youth-who-was-to-serve-three-years-without-pay,"Then the princess drew the ring from his finger, put it on herself, and wished the youth might be lying on the garbage-pile in the street, just as tattered and torn as he had come to them, and in his place she wanted the handsomest prince in the world."
youth-who-was-to-serve-three-years-without-pay,And that very minute everything happened just as she wished.
youth-who-was-to-serve-three-years-without-pay,"After a time the youth woke up, out on the garbage-pile, and at first thought he was dreaming: but when he saw the ring was gone, he understood how it all had happened, and fell into such despair that he got up and wanted to jump right into the sea."
youth-who-was-to-serve-three-years-without-pay,But then he met the cat his master had bought for him.
youth-who-was-to-serve-three-years-without-pay,"""Where are you going?"""
youth-who-was-to-serve-three-years-without-pay,she asked.
youth-who-was-to-serve-three-years-without-pay,"""To throw myself into the sea and drown,"" was the youth's reply."
youth-who-was-to-serve-three-years-without-pay,"""Do not do so on any account,"" said the cat."
youth-who-was-to-serve-three-years-without-pay,"""You will get your ring again."""
youth-who-was-to-serve-three-years-without-pay,"""Yes, if that were so, then ..."" said the youth."
youth-who-was-to-serve-three-years-without-pay,The cat ran away.
youth-who-was-to-serve-three-years-without-pay,Suddenly a rat crossed her path.
youth-who-was-to-serve-three-years-without-pay,"""Now I will pounce on you!"""
youth-who-was-to-serve-three-years-without-pay,said the cat.
youth-who-was-to-serve-three-years-without-pay,"""O do not do that,"" said the rat, ""you shall have the ring again!"""
youth-who-was-to-serve-three-years-without-pay,"""Well, if that is so, then ..."" said the cat."
youth-who-was-to-serve-three-years-without-pay,"When the folk at the castle had gone to bed, the rat crept around, and sniffed and spied out the room of the prince and princess; and at last he found a little hole through which he crawled."
