document_id,text
youth-who-was-to-serve-three-years-without-pay,"Then he heard the prince and princess talking to each other, and saw that the prince was wearing the ring on his finger."
youth-who-was-to-serve-three-years-without-pay,"Before she went, the princess said: ""Good night. And see that you take good care of the ring, my dearest!"""
youth-who-was-to-serve-three-years-without-pay,"""Pooh! no one will come in through the walls for the sake of a ring,"" said the prince, ""but if you think it is not safe enough on my hand, why, I can put it in my mouth."""
youth-who-was-to-serve-three-years-without-pay,"After a time he lay down on his back, and prepared to go to sleep."
youth-who-was-to-serve-three-years-without-pay,"But just then the ring slipped down his throat, and he had to cough, so that the ring flew out and rolled along the ground."
youth-who-was-to-serve-three-years-without-pay,"Swish!--the rat had caught it, and crept out with it to the cat, who was waiting at the rat-hole."
youth-who-was-to-serve-three-years-without-pay,"But in the meantime the king had caught the youth, and had had him put in a great tower and condemned to death, because he had made a mock of his daughter--so the king said."
youth-who-was-to-serve-three-years-without-pay,And the youth was to sit in the tower until he was beheaded.
youth-who-was-to-serve-three-years-without-pay,"But the cat kept prowling around the tower all the time, trying to sneak in with the ring."
youth-who-was-to-serve-three-years-without-pay,"And then an eagle came along, caught her up in his claws and flew across the sea with her."
youth-who-was-to-serve-three-years-without-pay,"And suddenly a hawk appeared, and flung himself on the eagle, and the eagle let the cat fall into the sea."
youth-who-was-to-serve-three-years-without-pay,"When she felt the water, she grew afraid, let the ring fall, and swam to land."
youth-who-was-to-serve-three-years-without-pay,No sooner had she shaken the water from her fur than she met the dog whom the youth's master had bought for him.
youth-who-was-to-serve-three-years-without-pay,"""Well, what am I to do now?"" said the cat, and wept and lamented."
youth-who-was-to-serve-three-years-without-pay,"""The ring is gone, and they want to murder the youth."""
youth-who-was-to-serve-three-years-without-pay,"""That I do not know,"" said the dog, ""but what I do know is that I have the very worst kind of an ache in my stomach,"" said he."
youth-who-was-to-serve-three-years-without-pay,"""There you have it. You have surely over-eaten,"" said the cat."
youth-who-was-to-serve-three-years-without-pay,"""I never eat more than I need,"" said the dog, ""and just now I have eaten nothing at all, save a dead fish that was left here by the ebb-tide."""
youth-who-was-to-serve-three-years-without-pay,"""Could the fish have swallowed the ring?"" asked the cat."
youth-who-was-to-serve-three-years-without-pay,"""And must you, also, lose your life, because you cannot digest gold?"""
youth-who-was-to-serve-three-years-without-pay,"""That may well be the case,"" said the dog."
youth-who-was-to-serve-three-years-without-pay,"""But then it would be best if I died at once, for then the youth might still be saved."""
youth-who-was-to-serve-three-years-without-pay,"""O, that is not necessary!"" said the rat--who was there, too--""I do not need a very large opening through which to crawl, and if the ring is really there, I am sure I can find it."""
youth-who-was-to-serve-three-years-without-pay,"So the rat slipped down into the dog, and before very long he came out again with the ring."
youth-who-was-to-serve-three-years-without-pay,"And then the cat made her way to the tower, and clawed her way up till she found a hole through which she could thrust her paw, and thus brought back the ring to the youth."
youth-who-was-to-serve-three-years-without-pay,"No sooner was it on his finger than he wished that the tower might break down, and that very moment he was standing just before the tower-gate, and reviling the king and the queen and the king's daughter as though they were the lowest of the low."
youth-who-was-to-serve-three-years-without-pay,"The king hastily called together his army, and told it to surround the tower, and take the youth prisoner, dead or alive."
youth-who-was-to-serve-three-years-without-pay,"But the youth only wished the whole army might be sticking up to their necks in the big swamp in the hills, and there they had trouble enough getting out--those among them who did not stick fast."
youth-who-was-to-serve-three-years-without-pay,"Then he went right on reviling where he had stopped, and finally, when he had told them all just what he thought of them, he wished that the king, the queen and the king's daughter might sit for the rest of their lives in the tower into which they had thrust him."
youth-who-was-to-serve-three-years-without-pay,"And when they were sitting there, he took possession of the king's land and country on his own account."
youth-who-was-to-serve-three-years-without-pay,"Then the dog changed into a prince, and the cat into a princess, and he made the latter his wife, and they were married and celebrated their wedding long and profusely."
