document_id,text
comrade,"Yes, such was really the case."
comrade,"Then he took up his sword, but when he raised it and was about to divide the child, his comrade seized the point of the sword so that he could not strike."
comrade,"""Are you not happy, since you need not strike?"" said he."
comrade,"""Yes, indeed, I never was happier,"" said the man."
comrade,"""That is how happy I was when you delivered me out of the block of ice,"" said the comrade."
comrade,"""Keep all you have: I need nothing, for I am a disembodied spirit."""
comrade,"And he told him he was the wine-dealer who had lain in the block of ice before the church door, spat upon by all."
comrade,"He had become his comrade, and had aided him, because the youth had sacrificed all he had in order that he might have peace, and a burial in consecrated ground."
comrade,"He had been permitted to accompany him for the space of a year, and the time had run out when he had first parted with him."
comrade,"Now he had once more been allowed to visit him; yet on this occasion he would have to part for all time, for the bells of heaven were calling him."
