section,text
36,"In the end all the marvels were done, and Kilweh set forward, and with
him Goreu, the son of Custennin, to Yspaddaden Penkawr, bearing in their
hands the razor, the scissors and the comb, and Yspaddaden Penkawr was
shaved by Kaw.

'Is your daughter mine now?' asked Kilweh.

'She is yours,' answered Yspaddaden, 'but it is Arthur and none other
who has won her for you. Of my own free will you should never have
had her, for now I must lose my life.' And as he spake Goreu the son of
Custennin cut off his head, as if had been ordained, and Arthur's hosts
returned each man to his own country."
