question_id,local-or-sum,cor_section,attribute1,attribute2,question,ex-or-im1,answer1,answer2,answer3,ex-or-im2,answer4,answer5,answer6
1,local,1,character,,"Who was a very good-natured little fellow, and did his duties so willingly and well that everybody liked him?",explicit,a little page-boy,,,explicit,A little page-boy,,
2,local,1,setting,,Where did the little page-boy work?,explicit,the Castle,,,explicit,A stately Castle,,
3,local,1,character,,Who did the little page-boy serve?,explicit,the great Earl,,,explicit,The Great Earl,,
4,local,1,causal relationship,,Why did the Castle have a little postern that that opened to a narrow flight of steps?,explicit,Anyone who liked could go down there in the pleasant summer mornings and bathe in the shimmering sea.,,,explicit,So that anyone who liked could go down to the sea shore,,
5,local,2,causal relationship,,Why was the little page-boy very fond of going out on this moor?,explicit,"He could run about as much as he liked, chasing bumble-bees, and catching butterflies, and looking for birds' nests when it was nesting time.",,,explicit,He could run about as much as he liked,,
6,local,2,causal relationship,,Why did the bulter allow the little page-boy to go out on this moor?,explicit,He knew that it was good for a healthy little lad to have plenty of fun in the open air.,,,explicit,He knew that it was good for a healthy little lad to have plenty of fun in the open air,,
7,local,2,action,,What was the warning the butler gave to the little page-boy?,explicit,keep far away from the Fairy Knowe,,,explicit,Keep far away from the Fairy Knowe,,
8,local,2,causal relationship,,Why did the butler want the little page-boy to stay away from the Fairy Knowe?,implicit,The little Folk should not be trusted.,,,explicit,The Little Folk are not to trust,,
9,local,3,character,,Who would punish any rash mortal who came too near them?,explicit,the Fairies,,,explicit,Fairies,,
10,local,3,action,,What did the country people do to avoid going too near the Fairy Knowe?,explicit,walk a good half-mile out of their way,,,explicit,Walk a good half-mile out of their way,,
11,local,3,causal relationship,,Why didn't the country people go to the moor at night?,explicit,"Everyone knows that Fairies come abroad in the darkness, and the door of their dwelling stands open, so that any luckless mortal who does not take care may find himself inside.",,,explicit,Fairies come abroad in the darkness,,
12,local,3,causal relationship,,Why was the little page-boy anxious to see the Fairies?,explicit,The little page-boy was an adventurous wight.,,,explicit,He was an adventurous wright,,
13,local,3,action,,What did the little page-boy want to do at the Fairy Knowe?,explicit,"see them, and to visit their abode, just to find out what it was like",,,explicit,"Visit their abode, just to find out what it was like",,
14,local,4,action,,What did the little page-boy do one night when everyone was asleep?,explicit,"crept out of the Castle by the little postern door, and stole down the stone steps, and along the sea shore, and up on to the moor, and went straight to the Fairy Knowe",,,explicit,He krept out of the Castle,,
15,summary,"3, 4",feeling,,How will the little page-boy feel when he reaches the Fairy Knowe?,explicit,delight,,,implicit,Adventurous,Brave,Full of wonder
16,local,4,feeling,,How did the little page-boy feel when he slipped inside the Knowe?,implicit,excited,thrilled,delighted,implicit,Delighted,Excited,
17,local,4,causal relationship,,Why was the little page-boy delighted?,explicit,He found that what everyone said was true.,,,explicit,"The top of the Knowe was tipped up and from the opening that was thus made, rays of light came streaming out",,
18,local,5,character,,Who did the little page-boy see after he slipped inside the Knowe?,explicit,"the Tiny Folk, Fairies, and Elves, and Gnomes",,,explicit,"Scores of Tiny Folk, Fairies, and Elves and Gnomes",,
19,local,5,action,,What did the little page-boy do after he came into a large room?,explicit,"stood in a dark corner watching the busy scene in wonder, thinking how strange it was that there should be such a number of these tiny beings living their own lives all unknown to men",,,explicit,He stood in a dark corner watching the busy scene in wonder,,
20,local,5,action,,What did the two Fairy Pages do after someone gave an order?,explicit,"darted from the table to a tiny cupboard in the rock, and returned staggering under the weight of a most beautiful silver cup, richly embossed and lined inside with gold",,,explicit,"They darted from the table to a tiny cupboard in the rock, and returned staggering under the weight of a most beautiful silver cup",,
21,local,6,action,,What did the Fairies do after the cup was placed on the table?,explicit,began to drink out of it in turn,,,explicit,All the fairies began to drink out of it in turn,,
22,local,6,action,,What did the little page-boy notice?,explicit,"no one poured wine into it, and yet it was always full, and that the wine that was in it was not always the same kind",,,explicit,No one poured wine into it and yet it was always full,,
23,local,6,action,,What did each Fairy do after they grasped its stem?,explicit,wished for the wine that he loved best,,,explicit,Wish for the win that he loved best,,
24,local,"6, 8",prediction,outcome resolution,What will happen after the little page-boy takes the cup?,explicit,The Fairies will chase him.,,,implicit,He will bring it back and show it to the Earl,,
25,local,"6, 8",action,,What did the little page boy want to do after watching the Fairies drink from the cup?,explicit,take the cup home with him,,,implicit,Take the cup back to the castle,,
26,summary,"6, 7",prediction,feeling,How will the Fairies feel when they see the little page-boy?,explicit,pleased,,,implicit,Surprised,Pleased,
27,summary,"6, 7",prediction,action,What will the Fairies do when they see the little page-boy ?,explicit,invite him to a seat at the table,,,implicit,They will trick him,They will hurt him,
28,local,"6, 7",prediction,outcome resolution,What will happen after the Fairies ask the little page-boy to sit down at the table?,explicit,They will grow rude and insolent.,,,implicit,They will make fun of him for serving mortals,,
29,local,7,action,,How were the Fairies rude to the little page-boy?,explicit,"jeered at him for being content to serve mere mortals, telling him that they saw everything that went on at the Castle, and making fun of the old butler",,,explicit,They jeered at him for being content to serve mere mortals,,
30,local,7,causal relationship,,Why couldn't the little page-boy stand their teasing remarks any longer?,explicit,They laughed at the food he ate.,,,implicit,They made fun of the butler and the food that he ate,He knew that if he wanted to secure the cup he must not lose anymore time,
31,local,7,outcome resolution,,What happened after the little page-boy grabbed the stem of the cup?,explicit,the ruby wine was turned to clear cold water.,,,explicit,The ruby wine was turned to clear cold water,,
32,local,7,causal relationship,,Why did the ruby wine turn into clear cold water?,implicit,The little page boy wished for water.,The little page boy wanted water.,,implicit,They boy wished it to be water,"They boy said ""I'll drink to you all in water""",
33,local,8,causal relationship,,Why didn't the little page-boy drink from the cup?,explicit,He threw the water over the candles.,,,explicit,He threw the water over the candles,,
34,local,7,feeling,,How did the little page-boy feel after the Fairies teased him?,implicit,angry,upset,mad,implicit,Angry,Upset,Hurt
35,local,8,action,,What did the little page-boy do after he threw the water over the candles?,explicit,"clasped the precious cup tightly in his arms, he sprang to the opening of the Knowe",,,explicit,"Then, clasping the precious cup tighly in his arms, he sprang to the opening of the Knowe",,
36,summary,"7, 8",prediction,feeling,How will the Fairies feel after the little page-boy threw water over the candles?,implicit,angry,mad,furious,explicit,They were wild with rage,,
37,local,8,action,,What did the Fairies do after the little page-boy took the cup?,implicit,chased him,ran after him,,implicit,Chase after him,Run after him,
38,local,8,feeling,,How did the little page-boy feel after he realized the Fairies were chasing him?,implicit,scared,concerned,worried,implicit,Very afraid,Scared for his life,
39,local,9,outcome resolution,,What happened after the little page-boy believed he could not escape?,implicit,A mysterious voice helped him.,A mysterious voice told him where to go.,,implicit,"A voice said ""If you would gain the Castle door, Keep to the black stones on the shore""",,
40,local,9,character,,Who had been taken prisoner by the Fairies and did not want a like fate to befall the adventurous page-boy?,explicit,a poor mortal,,,explicit,Some poor mortal,,
41,local,9,causal relationship,,Why did the little page-boy run to the shore?,explicit,A voice told him.,He heard this story before.,,explicit,"He had once heard that if anyone walked on the wet sands, where the waves had come over them, the Fairies could not touch him",,
42,local,10,outcome resolution,,What happened after the little page-boy reached the shore?,explicit,He was safe from the Fairies.,He escaped from the Fairies.,,explicit,The little Fold could go no step further,,
43,local,10,feeling,,How did the Fairies feel after the little page-boy reached the shore?,implicit,angry,upset,,explicit,Rage and disappointment,,
44,local,10,causal relationship,,Why couldn't the Fairies chase after the little page-boy anymore?,implicit,He walked on the wet sands.,He reached the wet sands.,,implicit,He was protected by the wet sand,,
45,local,10,action,,What did the little page-boy do before the Fairies were about to lay hands on him?,explicit,"jumped across the water-mark on to the firm, wet sand",,,explicit,"He jumped across the water-mark on to the firm, wet sand",,
46,local,10,action,,What did the little page-boy do after he escaped from the Fairies?,explicit,"ran safely along the shore, his precious cup in his arms, and climbed lightly up the steps in the rock and disappeared through the postern",,,explicit,"Ran safey along the shore, his precious cup in his arms and climbed lightly up the steps in the rock and disappeared through the Postern",,
47,local,10,action,,What did the little page-boy do many years later?,explicit,"had grown up and become a stately butler, who trained other little page-boys to follow in his footsteps",,,explicit,"Become a stately butler, who trained other little page-boys",,
