document_id,text
the-red-swan,"till it resounded with its shrill tone through the whole country, far and wide."
the-red-swan,"Meanwhile the magician had remembered the instructions of Maidwa, placing his head outside of the lodge as soon as he heard the ka-kak cry of the hawk."
the-red-swan,"In a moment Maidwa came past with rustling wings, and as he flew by, giving the magician a severe blow on the head with the wampum scalp, his limbs extended and quivered in an agony, the scalp adhered, and Maidwa, in his own person, walked into the lodge and sat down, feeling perfectly at home."
the-red-swan,"The magician was so long in recovering from the stunning blow which had been dealt him, that Maidwa feared that in restoring the crown of his head he had destroyed his life."
the-red-swan,"Presently, however, he was pleased to see him show, by the motion of his hands and limbs, that his strength was returning; and in a little while he rose and stood upon his feet."
the-red-swan,"What was the delight of Maidwa to behold, instead of a withered old man, far advanced in years and stricken in sorrow, a bright and cheerful youth, who glittered with life as he stood up before him."
the-red-swan,"""Thank you, my friend,"" he said."
the-red-swan,"""Your kindness and bravery of heart have restored me to my former shape. It was so ordained, and you have now accomplished the victory."""
the-red-swan,"They embraced; and the young magician urged the stay of his deliverer for a few days, and they formed a strong attachment to each other."
the-red-swan,"The magician, to the deep regret of Maidwa, never once alluded to the Red Swan in all their conferences."
the-red-swan,At last the day arrived when Maidwa prepared to return to his home.
the-red-swan,"The young magician bestowed on him ample presents of wampum, fur, robes, and other costly things."
the-red-swan,"Although Maidwa's heart was burning within him to see the Red Swan, to hear her spoken of, and to learn what his fortune was to be in regard to that fond object of his pursuit, he constrained his feelings, and so checked his countenance as to never look where he supposed she might be."
the-red-swan,His friend the young magician observed the same silence and caution.
the-red-swan,"Maidwa's pack for traveling was now ready, and he was taking his farewell smoke, when the young magician thus addressed him: ""My friend Maidwa, you know for what cause you came thus far, and why you have risked so much and waited so long. You have proved my friend indeed. You have accomplished your object, and your noble perseverance shall not go unrewarded. If you undertake other things with the same spirit, you will always succeed. My destiny compels me to remain where I am, although I should feel happy to be allowed to go with you. I have given you, of ordinary gifts, all you will need as long as you live; but I see you are backward to speak of the Red Swan. I vowed that whoever procured me my lost wampum-scalp should be rewarded by possessing the Red Swan."""
the-red-swan,"He then spoke in a language which Maidwa did not understand, the curtain of the lodge parted, and the Red Swan met his gaze."
the-red-swan,"It was a beautiful female that he beheld, so majestical and airy in her look, that he seemed to see a creature whose home should rather be in the free heaven, and among the rosy clouds, than in this dusky lodge."
the-red-swan,"""Take her,"" the young magician said; ""she is my sister; treat her well. She is worthy of you, and what you have done for me merits more. She is ready to go with you to your kindred and friends, and has been so ever since your arrival; and my good wishes shall go with you both."""
the-red-swan,"The Red Swan smiled kindly on Maidwa, who advanced and greeted her."
the-red-swan,"Hand in hand they took their way forth from the lodge, and, watched by the young magician, advanced across the prairie on their homeward course."
the-red-swan,"They traveled slowly, and looked with double joy on the beautiful country over which they had both so lately passed with hearts ill at ease."
the-red-swan,After two or three days they reached the lodge of the third old man who had entertained him with the singing kettle; but the kettle was not there.
the-red-swan,"The old man, nevertheless, received them very kindly, and said to Maidwa, ""You see what your perseverance has secured you; do so always, and you will succeed in whatever you undertake."""
the-red-swan,"On the following morning, when they were about to start, he pulled from the side of the lodge a bag, which he presented to Maidwa, saying, ""Grandchild, I give you this; it contains a present for you; and I hope you will live happily till old age."""
the-red-swan,"Bidding him farewell, they again set forward; and they soon came to the second old man's lodge; he also gave them a present and bestowed his blessing."
the-red-swan,Nor did Maidwa see any thing here of the frisky little kettle which had been so lively on his former visit.
the-red-swan,"As they went on and came to the lodge of the first old man, their reception and farewell were the same; and when Maidwa glanced to the corner, the silent kettle, which had been the first acquaintance he had made in that family on his travels, was not there."
the-red-swan,"The old man smiled when he discovered the direction of Maidwa's glance, but he said nothing."
the-red-swan,"When, on continuing their journey, they at last approached the first town which Maidwa had passed in his pursuit, the watchman gave notice as before, and he was shown into the chief's lodge."
the-red-swan,"""Sit down there, son-in-law,"" said the chief, pointing to a place near his daughter."
the-red-swan,"""And you also,"" he said to the Red Swan."
the-red-swan,"The chief's daughter was engaged in coloring a girdle, and, as if indifferent to these visitors, she did not even raise her head."
the-red-swan,"Presently the chief said, ""Let some one bring in the bundle of our son-in-law."""
the-red-swan,"When the bundle was laid before him, Maidwa opened one of the bags which had been given to him."
the-red-swan,"It was filled with various costly articles--wampum, robes, and trinkets, of much richness and value; these, in token of his kindness, he presented to the chief."
the-red-swan,"The chief's daughter stole a glance at the costly gifts, then at Maidwa and his beautiful wife."
the-red-swan,"She stopped working, and was silent and thoughtful all the evening."
the-red-swan,"The chief himself talked with Maidwa of his adventures, congratulated him on his good fortune, and concluded by telling him that he should take his daughter along with him in the morning."
the-red-swan,"Maidwa said ""Yes."""
the-red-swan,"The chief then spoke up, saying, ""Daughter, be ready to go with him in the morning."""
the-red-swan,"Now it happened when the chief was thus speaking that there was a foolish fellow in the lodge, who had thought to have got this chief's daughter for a wife; and he jumped up, saying: ""Who is he,"" looking grimly at Maidwa, ""that he should take her for a few presents? I will kill him."""
the-red-swan,"And he raised a knife which he had in his hand, and gave it a mighty flourish in the air."
the-red-swan,"He kept up this terrible flourish till some one came and pulled him back to his seat, which he had been waiting for, and then he sat quiet enough."
the-red-swan,"Amid the greetings of their new friends, Maidwa and the Red Swan, with the chief's daughter, took their leave by peep of day, and toward evening they reached the other town."
the-red-swan,"The watchman gave the signal, and numbers of men, women and children stood out to see them."
the-red-swan,"They were again shown into the chief's lodge, who welcomed him, saying: ""Son-in-law, you are welcome."""
the-red-swan,"And he requested Maidwa to take a seat by his daughter, and the two women did the same."
the-red-swan,"After suitable refreshment for all, and while Maidwa smoked a pipe, the chief asked him to relate his adventures in the hearing of all the inmates of the lodge, and of the strangers who had gathered in at report of his singular fortunes."
the-red-swan,Maidwa gave them his whole story.
the-red-swan,"When he came to those parts which related to the Red Swan, they turned and looked upon her in wonder and admiration, for she was very beautiful."
the-red-swan,"The chief then informed Maidwa that his brothers had been to their town in search of him, but that they had gone back some time before, having given up all hopes of ever seeing him again."
the-red-swan,"He added, that since he had shown himself a man of spirit, whom fortune was pleased to befriend, he should take his daughter with him."
the-red-swan,"""For although your brothers,"" he said, ""were here, they were too bashful to enter any of our lodges. They merely inquired for you and returned. You will take my daughter, treat her well, and that will bind us more closely together."""
the-red-swan,"It is always the case in an assembly or gathering that some one of the number is foolish, and disposed to play the clown."
the-red-swan,It happened to be so here.
the-red-swan,"One of this very sort was in the lodge, and, after Maidwa had given the old chief presents, as he had to the other, this pretender jumped up in a passion, and cried out: ""Who is this stranger, that he should have her? I want her myself."""
the-red-swan,"The chief bade him be quiet, and not to disturb or quarrel with one who was enjoying their hospitality."
the-red-swan,"""No, no,"" he exclaimed, rushing forward as in act to strike."
the-red-swan,"Maidwa sat unmoved, and paid no heed to his threats."
the-red-swan,"He cried the louder--""I will have her, I will have her!"""
the-red-swan,"whereupon the old chief, being now vexed past patience, took his great war-club and tapped this clownish fellow upon the head, which so far subdued him that he sat for some time quite still; when, after a while, he came to himself, the chief upbraided him for his folly, and told him to go out and tell stories to the old women."
the-red-swan,"When at last Maidwa was about to leave, he invited a number of the families of the chief to go with him and visit their hunting-grounds, where he promised them that they would find game in abundance."
the-red-swan,"They consented, and in the morning a large company assembled and joined Maidwa; and the chief, with a party of warriors, escorted them a long distance."
the-red-swan,"When ready to return, the chief made a speech and besought the blessing of the Good Spirit on Maidwa and his friends."
the-red-swan,"They parted, each on its course, making music with their war-drums, which could be heard from afar as they glittered with waving feathers in the morning sun, in their march over the prairie, which was lost in the distant sky."
the-red-swan,"After several days' travel, Maidwa and his friends came in sight of his home."
the-red-swan,The others rested within the woods while he went alone in advance to see his brothers.
the-red-swan,He entered the lodge.
the-red-swan,It was all in confusion and covered with ashes.
the-red-swan,"On one side, sitting among the cinders, with his face blackened, and crying aloud, was his elder brother."
the-red-swan,"On the other side sat the younger, Jeekewis, also with blackened face, his head covered with stray feathers and tufts of swan-down."
the-red-swan,This one presented so curious a figure that Maidwa could not keep from laughing.
the-red-swan,He seemed to be so lost and far-gone in grief that he could not notice his brother's arrival.
the-red-swan,"The eldest, however, after a while, lifting up his head, recognized Maidwa, jumped up and shook hands, and kissed him, and expressed much joy at his return."
the-red-swan,"Maidwa, as soon as he had seen the lodge set in order, made known that he had brought each of them a wife."
the-red-swan,"As soon as Jeekewis heard a wife spoken of, he roused from his torpor, sprang to his feet, and said: ""Why is it just now that you have come?"" and at once made for the door and peeped out to see the strangers."
the-red-swan,"He then commenced jumping and laughing, and crying out, ""Women! women!"""
the-red-swan,and that was all the reception he gave his brother.
the-red-swan,"Maidwa told them to wash themselves and prepare, for he would go and fetch the females in."
the-red-swan,"Jeekewis scampered about, and began to wash himself; but he would every now and then, with one side of his head all feathers, and the other clear and shining, peep forth to look at the women again."
the-red-swan,"When they came near, he said, ""I will have this and that one;"" he did not exactly know which; he would sit down for an instant, and then rise, and peep about and laugh; in fact he acted like one beside himself."
the-red-swan,"As soon as order was restored, and all the company who had been brought in were seated, Maidwa presented one of the chief's daughters to his eldest brother, saying: ""These women were given to me, to dispose of in marriage. I now give one to each. I intended so from the first."""
the-red-swan,"Jeekewis spoke up and said, ""I think three wives would have been enough for you."""
the-red-swan,"Maidwa led the other daughter to Jeekewis, and said, ""My brother, here is one for you, and live happily."""
the-red-swan,"Jeekewis hung down his head as if he was ashamed, but he would every now and then steal a look at his wife and also at the other women."
the-red-swan,By and by he turned toward his wife and acted as if he had been married for years.
the-red-swan,"Maidwa seeing that no preparation had been made to entertain the company, said, ""Are we to have no supper?"""
the-red-swan,"He had no sooner spoken, than forth from a corner stepped the silent kettle, which placed itself by the fire, and began bubbling and boiling quite briskly."
the-red-swan,"Presently that was joined by the big talking kettle, which said, addressing itself to Maidwa, ""Master, we shall be ready presently;"" and then, dancing along, came, from still another, the frisky little kettle, which hopped to their side, and took an active part in the preparations for the evening meal."
the-red-swan,"When all was nearly ready, a delicate voice was heard singing in the last corner of the lodge, and keeping up its dainty carol all the way to the fire-place, the fourth kettle joined the three cooks, and they all fell to with all their might, and in the best possible humor, to dispatch their work."
the-red-swan,"It was not long before the big kettle advanced toward Maidwa, and said, in his own confident way, ""Supper is ready!"""
the-red-swan,"The feast was a jovial one; and although they were all hungry, and plied their ladles with right good will, yet, dip in as often as they would, the four magic kettles held out, and had plenty to the end of the revel."
the-red-swan,"To draw to a close, Maidwa and his friends lived in peace for a time; their town prospered; there was no lack of children; and every thing else was in abundance."
the-red-swan,"One day the two brothers began to look dark upon Maidwa, and to reproach him for having taken from the medicine-sack their deceased father's magic arrows; they upbraided him especially that one was lost."
the-red-swan,"After listening to them in silence, he said that he would go in search of it, and that it should be restored; and the very next day, true to his word, he left them."
the-red-swan,"After traveling a long way, and looking in every direction, almost hopeless of discovering the lost treasure, he came to an opening in the earth, and descending, it led him to the abode of departed spirits."
the-red-swan,"The country appeared beautiful, the pastures were greener than his own, and the sky bluer than that which hung over the lodge, and the extent of it was utterly lost in a dim distance; and he saw animals of every kind wandering about in great numbers."
the-red-swan,The first he came to were buffalos; his surprise was great when they addressed him as human beings.
the-red-swan,"They asked him what he came for, how he had descended, and why he was so bold as to visit the abode of the dead."
the-red-swan,"He answered that he was in quest of a magic arrow, to appease the anger of his brothers."
the-red-swan,"""Very well,"" said the leader of the buffalos, whose form was nothing but bone."
the-red-swan,"""Yes, we know it,"" and he and his followers moved off a little space from Maidwa, as if they were afraid of him."
the-red-swan,"""You have come,"" resumed the buffalo-spirit, ""to a place where a living man has never before been. You will return immediately to your tribe, for, under pretense of recovering one of the magic arrows which belong to you by your father's dying wish, they have sent you off that they might become possessed of your beautiful wife, the Red Swan. Speed home! You will find the magic arrow at the lodge-door. You will live to a very old age, and die happily. You can go no further in these abodes of ours."""
the-red-swan,"Maidwa looked, as he thought, to the west, and saw a bright light as if the sun was shining in its splendor, but he saw no sun."
the-red-swan,"""What light is that yonder?"" he asked."
the-red-swan,The all-boned buffalo
the-red-swan,"answered--""It is the place where those who were good dwell."""
the-red-swan,"""And that dark cloud?"""
the-red-swan,Maidwa again asked.
the-red-swan,"""It is the place of the wicked,"" answered the buffalo."
the-red-swan,"Maidwa turned away, for it was very dark, and it pained his eyes to look upon it; and, moving away by the aid of his guardian spirits, he again stood upon the earth, and beheld the sun giving light as usual."
the-red-swan,"All else that he learned in the abodes of the dead, and his travels and acts previous to his return homeward, are unknown, for he never spoke of them to any human being."
the-red-swan,"After wandering a long time to gather knowledge to make his people happy and to add to their comfort, he one evening drew near to his own village."
the-red-swan,"Passing all the other lodges he came to his own door, where he found the magic arrow, as he had been promised."
the-red-swan,He heard his brothers from within at high words with each other.
the-red-swan,"They were quarreling for the possession of his wife, who, through all his absence, had remained constant, and sadly awaited his return."
the-red-swan,Maidwa listened in shame and sorrow.
the-red-swan,"He entered the lodge, holding his head aloft as one conscious of good principle and shining with anger."
the-red-swan,"He spoke not a word, but, placing the magic arrow to his bow, he would have laid his brothers dead at his feet; but just then the talking kettle stepped forward and spoke such words of wisdom, and the singing kettle trolled forth such a soothing little song, and the guilty brothers were so contrite and keenly repentant of their intended wrong, and the Red Swan was so radiant and forgiving, the silent kettle straightway served them up so hearty and wholesome a meal, and the frisky little kettle was so joyful and danced about so merrily, that when the magic arrows were laid away in the medicine-sack by Maidwa, there was that night in all the Indian country no happier family than the three brothers, who ever after dwelt together in all kindness, as all good brothers should."
